Index,Title,URL,Summary
53,"A Finite-Time Technological Singularity Model With Artificial
  Intelligence Self-Improvement",http://arxiv.org/abs/2010.01961v1,"Recent advances in the development of artificial intelligence, technological
progress acceleration, long-term trends of macroeconomic dynamics increase the
relevance of technological singularity hypothesis. In this paper, we build a
model of finite-time technological singularity assuming that artificial
intelligence will replace humans for artificial intelligence engineers after
some point in time when it is developed enough. This model implies the
following: let A be the level of development of artificial intelligence. Then,
the moment of technological singularity n is defined as the point in time where
artificial intelligence development function approaches infinity. Thus, it
happens in finite time. Although infinite level of development of artificial
intelligence cannot be reached practically, this approximation is useful for
several reasons, firstly because it allows modeling a phase transition or a
change of regime. In the model, intelligence growth function appears to be
hyperbolic function under relatively broad conditions which we list and
compare. Subsequently, we also add a stochastic term (Brownian motion) to the
model and investigate the changes in its behavior. The results can be applied
for the modeling of dynamics of various processes characterized by
multiplicative growth."
54,Creativity and Artificial Intelligence: A Digital Art Perspective,http://arxiv.org/abs/1807.08195v1,"This paper describes the application of artificial intelligence to the
creation of digital art. AI is a computational paradigm that codifies
intelligence into machines. There are generally three types of artificial
intelligence and these are machine learning, evolutionary programming and soft
computing. Machine learning is the statistical approach to building intelligent
systems. Evolutionary programming is the use of natural evolutionary systems to
design intelligent machines. Some of the evolutionary programming systems
include genetic algorithm which is inspired by the principles of evolution and
swarm optimization which is inspired by the swarming of birds, fish, ants etc.
Soft computing includes techniques such as agent based modelling and fuzzy
logic. Opportunities on the applications of these to digital art are explored."
55,"Foundations of Intelligence in Natural and Artificial Systems: A
  Workshop Report",http://arxiv.org/abs/2105.02198v1,"In March of 2021, the Santa Fe Institute hosted a workshop as part of its
Foundations of Intelligence in Natural and Artificial Systems project. This
project seeks to advance the field of artificial intelligence by promoting
interdisciplinary research on the nature of intelligence. During the workshop,
speakers from diverse disciplines gathered to develop a taxonomy of
intelligence, articulating their own understanding of intelligence and how
their research has furthered that understanding. In this report, we summarize
the insights offered by each speaker and identify the themes that emerged
during the talks and subsequent discussions."
56,The limit of human intelligence,http://arxiv.org/abs/2310.10792v2,"In 1998, Fields medalist Stephen Smale [S. Smale, Mathematical problems for
the next century, The mathematical Intelligencer, 20(2) (1998), 7-15] proposed
his famous eighteen problems to the mathematicians of this century. The
statement of his eighteenth problem is very simple but very important. He asked
""What are the limits of intelligence, both artificial and human?"". In this
paper, we prove that human intelligence is limitless. Moreover, we provide
justifications to state that artificial intelligence has limitations. Thus,
human intelligence will always remain superior to artificial intelligence.
Moreover, we provide justifications to conclude the limitations of artificial
intelligence."
57,"Is Artificial Intelligence Providing the Second Revolution for Weather
  Forecasting?",http://arxiv.org/abs/2401.16669v1,"The rapid advancement of artificial intelligence technologies, particularly
in recent years, has led to the emergence of several large parameter artificial
intelligence weather forecast models. These models represent a significant
breakthrough, overcoming the limitations of traditional numerical weather
prediction models and indicating a potential second revolution for weather
forecast. This study explores the evolution of these advanced artificial
intelligence forecast models, and based on the identified commonalities,
proposes the ""Three Large Rules"" for their development. We discuss the
potential of artificial intelligence in revolutionizing numerical weather
prediction, briefly outlining the underlying reasons for this potential.
Additionally, we explore key areas for future development prospects for large
artificial intelligence weather forecast models, integrating the entire
numerical prediction process. Through an example that combines a large
artificial intelligence model with ocean wave forecasting, we illustrate how
forecasters can adapt and leverage the advanced artificial intelligence model.
While acknowledging the high accuracy, computational efficiency, and ease of
deployment of large artificial intelligence forecast models, we emphasize the
irreplaceable values of traditional numerical forecasts. We believe that the
optimal future of weather forecasting lies in achieving a seamless integration
of artificial intelligence and traditional numerical models. Such a synthesis
is anticipated to offer a more comprehensive and reliable approach for future
weather forecasting."
58,On a Functional Definition of Intelligence,http://arxiv.org/abs/2312.09546v1,"Without an agreed-upon definition of intelligence, asking ""is this system
intelligent?"""" is an untestable question. This lack of consensus hinders
research, and public perception, on Artificial Intelligence (AI), particularly
since the rise of generative- and large-language models. Most work on precisely
capturing what we mean by ""intelligence"" has come from the fields of
philosophy, psychology, and cognitive science. Because these perspectives are
intrinsically linked to intelligence as it is demonstrated by natural
creatures, we argue such fields cannot, and will not, provide a sufficiently
rigorous definition that can be applied to artificial means. Thus, we present
an argument for a purely functional, black-box definition of intelligence,
distinct from how that intelligence is actually achieved; focusing on the
""what"", rather than the ""how"". To achieve this, we first distinguish other
related concepts (sentience, sensation, agency, etc.) from the notion of
intelligence, particularly identifying how these concepts pertain to artificial
intelligent systems. As a result, we achieve a formal definition of
intelligence that is conceptually testable from only external observation, that
suggests intelligence is a continuous variable. We conclude by identifying
challenges that still remain towards quantifiable measurement. This work
provides a useful perspective for both the development of AI, and for public
perception of the capabilities and risks of AI."
59,Tests of Machine Intelligence,http://arxiv.org/abs/0712.3825v1,"Although the definition and measurement of intelligence is clearly of
fundamental importance to the field of artificial intelligence, no general
survey of definitions and tests of machine intelligence exists. Indeed few
researchers are even aware of alternatives to the Turing test and its many
derivatives. In this paper we fill this gap by providing a short survey of the
many tests of machine intelligence that have been proposed."
60,An Approximation of the Universal Intelligence Measure,http://arxiv.org/abs/1109.5951v2,"The Universal Intelligence Measure is a recently proposed formal definition
of intelligence. It is mathematically specified, extremely general, and
captures the essence of many informal definitions of intelligence. It is based
on Hutter's Universal Artificial Intelligence theory, an extension of Ray
Solomonoff's pioneering work on universal induction. Since the Universal
Intelligence Measure is only asymptotically computable, building a practical
intelligence test from it is not straightforward. This paper studies the
practical issues involved in developing a real-world UIM-based performance
metric. Based on our investigation, we develop a prototype implementation which
we use to evaluate a number of different artificial agents."
61,Decision under Uncertainty,http://arxiv.org/abs/1304.1527v1,"We derive axiomatically the probability function that should be used to make
decisions given any form of underlying uncertainty."
62,The Book of Why: Review,http://arxiv.org/abs/1909.13485v1,"This is a review of ""The Book of Why"", by Judea Pearl."
63,Game-based Platforms for Artificial Intelligence Research,http://arxiv.org/abs/2304.13269v3,"Games have been the perfect test-beds for artificial intelligence research
for the characteristics that widely exist in real-world scenarios. Learning and
optimisation, decision making in dynamic and uncertain environments, game
theory, planning and scheduling, design and education are common research areas
shared between games and real-world problems. Numerous open-source games or
game-based environments have been implemented for studying artificial
intelligence. In addition to single- or multi-player, collaborative or
adversarial games, there has also been growing interest in implementing
platforms for creative design in recent years. Those platforms provide ideal
benchmarks for exploring and comparing artificial intelligence ideas and
techniques. This paper reviews the game-based platforms for artificial
intelligence research, provides guidance on matching particular types of
artificial intelligence with suitable games for testing and matching particular
needs in games with suitable artificial intelligence techniques, discusses the
research trend induced by the evolution of those platforms, and gives an
outlook."
64,"Bridging the Gap between Artificial Intelligence and Artificial General
  Intelligence: A Ten Commandment Framework for Human-Like Intelligence",http://arxiv.org/abs/2210.09366v1,"The field of artificial intelligence has seen explosive growth and
exponential success. The last phase of development showcased deep learnings
ability to solve a variety of difficult problems across a multitude of domains.
Many of these networks met and exceeded human benchmarks by becoming experts in
the domains in which they are trained. Though the successes of artificial
intelligence have begun to overshadow its failures, there is still much that
separates current artificial intelligence tools from becoming the exceptional
general learners that humans are. In this paper, we identify the ten
commandments upon which human intelligence is systematically and hierarchically
built. We believe these commandments work collectively to serve as the
essential ingredients that lead to the emergence of higher-order cognition and
intelligence. This paper discusses a computational framework that could house
these ten commandments and suggests new architectural modifications that could
lead to the development of smarter, more explainable, and generalizable
artificial systems inspired by a neuromorphic approach."
65,"Techniques for Adversarial Examples Threatening the Safety of Artificial
  Intelligence Based Systems",http://arxiv.org/abs/1910.06907v1,"Artificial intelligence is known as the most effective technological field
for rapid developments shaping the future of the world. Even today, it is
possible to see intense use of intelligence systems in all fields of the life.
Although advantages of the Artificial Intelligence are widely observed, there
is also a dark side employing efforts to design hacking oriented techniques
against Artificial Intelligence. Thanks to such techniques, it is possible to
trick intelligent systems causing directed results for unsuccessful outputs.
That is critical for also cyber wars of the future as it is predicted that the
wars will be done unmanned, autonomous intelligent systems. Moving from the
explanations, objective of this study is to provide information regarding
adversarial examples threatening the Artificial Intelligence and focus on
details of some techniques, which are used for creating adversarial examples.
Adversarial examples are known as training data, which can trick a Machine
Learning technique to learn incorrectly about the target problem and cause an
unsuccessful or maliciously directed intelligent system at the end. The study
enables the readers to learn enough about details of recent techniques for
creating adversarial examples."
66,Action Selection Properties in a Software Simulated Agent,http://arxiv.org/abs/cs/0211039v1,"This article analyses the properties of the Internal Behaviour network, an
action selection mechanism previously proposed by the authors, with the aid of
a simulation developed for such ends. A brief review of the Internal Behaviour
network is followed by the explanation of the implementation of the simulation.
Then, experiments are presented and discussed analysing the properties of the
action selection in the proposed model."
67,"Modular Belief Updates and Confusion about Measures of Certainty in
  Artificial Intelligence Research",http://arxiv.org/abs/1407.7281v1,"Over the last decade, there has been growing interest in the use or measures
or change in belief for reasoning with uncertainty in artificial intelligence
research. An important characteristic of several methodologies that reason with
changes in belief or belief updates, is a property that we term modularity. We
call updates that satisfy this property modular updates. Whereas probabilistic
measures of belief update - which satisfy the modularity property were first
discovered in the nineteenth century, knowledge and discussion of these
quantities remains obscure in artificial intelligence research. We define
modular updates and discuss their inappropriate use in two influential expert
systems."
68,Stovepiping and Malicious Software: A Critical Review of AGI Containment,http://arxiv.org/abs/1811.03653v2,"Awareness of the possible impacts associated with artificial intelligence has
risen in proportion to progress in the field. While there are tremendous
benefits to society, many argue that there are just as many, if not more,
concerns related to advanced forms of artificial intelligence. Accordingly,
research into methods to develop artificial intelligence safely is increasingly
important. In this paper, we provide an overview of one such safety paradigm:
containment with a critical lens aimed toward generative adversarial networks
and potentially malicious artificial intelligence. Additionally, we illuminate
the potential for a developmental blindspot in the stovepiping of containment
mechanisms."
69,"A Novel Method for Developing Robotics via Artificial Intelligence and
  Internet of Things",http://arxiv.org/abs/1405.3939v1,"This paper describe about a new methodology for developing and improving the
robotics field via artificial intelligence and internet of things. Now a day,
we can say Artificial Intelligence take the world into robotics. Almost all
industries use robots for lot of works. They are use co-operative robots to
make different kind of works. But there was some problem to make robot for
multi tasks. So there was a necessary new methodology to made multi tasking
robots. It will be done only by artificial intelligence and internet of things."
70,Human-Centered Artificial Intelligence and Machine Learning,http://arxiv.org/abs/1901.11184v1,"Humans are increasingly coming into contact with artificial intelligence and
machine learning systems. Human-centered artificial intelligence is a
perspective on AI and ML that algorithms must be designed with awareness that
they are part of a larger system consisting of humans. We lay forth an argument
that human-centered artificial intelligence can be broken down into two
aspects: (1) AI systems that understand humans from a sociocultural
perspective, and (2) AI systems that help humans understand them. We further
argue that issues of social responsibility such as fairness, accountability,
interpretability, and transparency."
71,"Machine Learning in Artificial Intelligence: Towards a Common
  Understanding",http://arxiv.org/abs/2004.04686v1,"The application of ""machine learning"" and ""artificial intelligence"" has
become popular within the last decade. Both terms are frequently used in
science and media, sometimes interchangeably, sometimes with different
meanings. In this work, we aim to clarify the relationship between these terms
and, in particular, to specify the contribution of machine learning to
artificial intelligence. We review relevant literature and present a conceptual
framework which clarifies the role of machine learning to build (artificial)
intelligent agents. Hence, we seek to provide more terminological clarity and a
starting point for (interdisciplinary) discussions and future research."
72,"Deep Learning, Natural Language Processing, and Explainable Artificial
  Intelligence in the Biomedical Domain",http://arxiv.org/abs/2202.12678v2,"In this article, we first give an introduction to artificial intelligence and
its applications in biology and medicine in Section 1. Deep learning methods
are then described in Section 2. We narrow down the focus of the study on
textual data in Section 3, where natural language processing and its
applications in the biomedical domain are described. In Section 4, we give an
introduction to explainable artificial intelligence and discuss the importance
of explainability of artificial intelligence systems, especially in the
biomedical domain."
73,"A Cybersecurity Risk Analysis Framework for Systems with Artificial
  Intelligence Components",http://arxiv.org/abs/2401.01630v1,"The introduction of the European Union Artificial Intelligence Act, the NIST
Artificial Intelligence Risk Management Framework, and related norms demands a
better understanding and implementation of novel risk analysis approaches to
evaluate systems with Artificial Intelligence components. This paper provides a
cybersecurity risk analysis framework that can help assessing such systems. We
use an illustrative example concerning automated driving systems."
74,"Quantifying Natural and Artificial Intelligence in Robots and Natural
  Systems with an Algorithmic Behavioural Test",http://arxiv.org/abs/1412.6703v2,"One of the most important aims of the fields of robotics, artificial
intelligence and artificial life is the design and construction of systems and
machines as versatile and as reliable as living organisms at performing high
level human-like tasks. But how are we to evaluate artificial systems if we are
not certain how to measure these capacities in living systems, let alone how to
define life or intelligence? Here I survey a concrete metric towards measuring
abstract properties of natural and artificial systems, such as the ability to
react to the environment and to control one's own behaviour."
75,Seeding the Singularity for A.I,http://arxiv.org/abs/1908.01766v1,"The singularity refers to an idea that once a machine having an artificial
intelligence surpassing the human intelligence capacity is created, it will
trigger explosive technological and intelligence growth. I propose to test the
hypothesis that machine intelligence capacity can grow autonomously starting
with an intelligence comparable to that of bacteria - microbial intelligence.
The goal will be to demonstrate that rapid growth in intelligence capacity can
be realized at all in artificial computing systems. I propose the following
three properties that may allow an artificial intelligence to exhibit a steady
growth in its intelligence capacity: (i) learning with the ability to modify
itself when exposed to more data, (ii) acquiring new functionalities (skills),
and (iii) expanding or replicating itself. The algorithms must demonstrate a
rapid growth in skills of dataprocessing and analysis and gain qualitatively
different functionalities, at least until the current computing technology
supports their scalable development. The existing algorithms that already
encompass some of these or similar properties, as well as missing abilities
that must yet be implemented, will be reviewed in this work. Future
computational tests could support or oppose the hypothesis that artificial
intelligence can potentially grow to the level of superintelligence which
overcomes the limitations in hardware by producing necessary processing
resources or by changing the physical realization of computation from using
chip circuits to using quantum computing principles."
76,"Physical Artificial Intelligence: The Concept Expansion of
  Next-Generation Artificial Intelligence",http://arxiv.org/abs/2105.06564v2,"Artificial Intelligence has been a growth catalyst to our society and is
cosidered across all idustries as a fundamental technology. However, its
development has been limited to the signal processing domain that relies on the
generated and collected data from other sensors. In recent research, concepts
of Digital Artificial Intelligence and Physicial Artifical Intelligence have
emerged and this can be considered a big step in the theoretical development of
Artifical Intelligence. In this paper we explore the concept of Physicial
Artifical Intelligence and propose two subdomains: Integrated Physicial
Artifical Intelligence and Distributed Physicial Artifical Intelligence. The
paper will also examine the trend and governance of Physicial Artifical
Intelligence."
77,Can Artificial Intelligence Do Everything That We Can?,http://arxiv.org/abs/1812.02560v1,"In this article, I discuss what AI can and cannot yet do, and the
implications for humanity."
78,Hybrid Super Intelligence and Polymetric Analysis,http://arxiv.org/abs/2111.09762v1,"The problem of possible applications Polymetric Analysis for the resolution
problems of artificial Intelligence is discussed. As example the hybrid super
intelligence system by N. Moiseev type was selected. The bond between
polymetric analysis and hybrid super intelligence system was shown. In
operational sense polymetric analysis is more general system. Therefore main
principles of Moiseev concept may be unify with the help of polymetric
analysis. Main peculiarities of this unification are analyzed."
79,Artificial Intelligence and Economic Theories,http://arxiv.org/abs/1703.06597v1,"The advent of artificial intelligence has changed many disciplines such as
engineering, social science and economics. Artificial intelligence is a
computational technique which is inspired by natural intelligence such as the
swarming of birds, the working of the brain and the pathfinding of the ants.
These techniques have impact on economic theories. This book studies the impact
of artificial intelligence on economic theories, a subject that has not been
extensively studied. The theories that are considered are: demand and supply,
asymmetrical information, pricing, rational choice, rational expectation, game
theory, efficient market hypotheses, mechanism design, prospect, bounded
rationality, portfolio theory, rational counterfactual and causality. The
benefit of this book is that it evaluates existing theories of economics and
update them based on the developments in artificial intelligence field."
80,"Use of Artificial Intelligence Techniques / Applications in Cyber
  Defense",http://arxiv.org/abs/1905.12556v1,"Nowadays, considering the speed of the processes and the amount of data used
in cyber defense, it cannot be expected to have an effective defense by using
only human power without the help of automation systems. However, for the
effective defense against dynamically evolving attacks on networks, it is
difficult to develop software with conventional fixed algorithms. This can be
achieved by using artificial intelligence methods that provide flexibility and
learning capability. The likelihood of developing cyber defense capabilities
through increased intelligence of defense systems is quite high. Given the
problems associated with cyber defense in real life, it is clear that many
cyber defense problems can be successfully solved only when artificial
intelligence methods are used. In this article, the current artificial
intelligence practices and techniques are reviewed and the use and importance
of artificial intelligence in cyber defense systems is mentioned. The aim of
this article is to be able to explain the use of these methods in the field of
cyber defense with current examples by considering and analyzing the artificial
intelligence technologies and methodologies that are currently being developed
and integrating them with the role and adaptation of the technology and
methodology in the defense of cyberspace."
