Index,Title,URL,Summary
22,"Symmetric and antisymmetric constitutive tensors for bi-isotropic and
  bi-anisotropic media",http://arxiv.org/abs/2204.10460v3,"The Maxwell equations and the constitutive relations describe the classical
propagation of electromagnetic waves in continuous matter. Here, we investigate
the effects stemming from extended constitutive relations on the propagation of
waves in bi-isotropic and bi-anisotropic media using a classical general
approach based on the evaluation of dispersion relations and refractive
indices. For the bi-anisotropic media, we specify two classes of
magnetoelectric parameters represented by symmetric and antisymmetric tensors.
The three cases examined have provided real and distinct refractive indices for
two propagating modes, which implies birefringence. The propagating modes were
also carried out in all cases. The anisotropy or birefringence effect, given by
the rotatory power or phase difference, was evaluated in terms of the
magnetoelectric parameters of the theory in each case. The propagation
orthogonal to the vectors used to parametrize the symmetric and antisymmetric
magnetoelectric tensors is described by distinct modes, representing a route to
identify the kind of bi-anisotropic medium examined. The group velocity and
Poynting vector were also evaluated for all the cases examined to discuss the
energy propagation in these anisotropic media."
23,"Graph-based Cyber Security Analysis of State Estimation in Smart Power
  Grid",http://arxiv.org/abs/1612.05878v1,"Smart power grid enables intelligent automation at all levels of power system
operation, from electricity generation at power plants to power usage at
households. The key enabling factor of an efficient smart grid is its built-in
information and communication technology (ICT) that monitors the real-time
system operating state and makes control decisions accordingly. As an important
building block of the ICT system, power system state estimation is of critical
importance to maintain normal operation of the smart grid, which, however, is
under mounting threat from potential cyber attacks. In this article, we
introduce a graph-based framework for performing cyber-security analysis in
power system state estimation. Compared to conventional arithmetic-based
security analysis, the graphical characterization of state estimation security
provides intuitive visualization of some complex problem structures and enables
efficient graphical solution algorithms, which are useful for both defending
and attacking the ICT system of smart grid. We also highlight several promising
future research directions on graph-based security analysis and its
applications in smart power grid."
24,"Hybrid Optimal Theory and Predictive Control for Power Management in
  Hybrid Electric Vehicle",http://arxiv.org/abs/1804.00757v1,"This paper presents a nonlinear-model based hybrid optimal control technique
to compute a suboptimal power-split strategy for power/energy management in a
parallel hybrid electric vehicle (PHEV). The power-split strategy is obtained
as model predictive control solution to the power management control problem
(PMCP) of the PHEV, i.e., to decide upon the power distribution among the
internal combustion engine, an electric drive, and other subsystems. A
hierarchical control structure of the hybrid vehicle, i.e., supervisory level
and local or subsystem level is assumed in this study. The PMCP consists of a
dynamical nonlinear model, and a performance index, both of which are
formulated for power flows at the supervisory level. The model is described as
a bi-modal switched system, consistent with the operating mode of the electric
ED. The performance index prescribing the desired behavior penalizes vehicle
tracking errors, fuel consumption, and frictional losses, as well as sustaining
the battery state of charge (SOC). The power-split strategy is obtained by
first creating the embedded optimal control problem (EOCP) from the original
bi-modal switched system model with the performance index. Direct collocation
is applied to transform the problem into a nonlinear programming problem. A
nonlinear predictive control technique (NMPC) in conjunction with a sequential
quadratic programming solver is used to compute suboptimal numerical solutions
to the PMCP. Methods for approximating the numerical solution to the EOCP with
trajectories of the original bi-modal PHEV are also presented in this paper.
The usefulness of the approach is illustrated via simulation results on several
case studies."
25,"The geometry of bi-Perron numbers with real or unimodular Galois
  conjugates",http://arxiv.org/abs/2009.03647v2,"Among all bi-Perron numbers, we characterise those all of whose Galois
conjugates are real or unimodular as the ones that admit a power which is the
stretch factor of a pseudo-Anosov homeomorphism arising from Thurston's
construction. This is in turn equivalent to admitting a power which is the
spectral radius of a bipartite Coxeter transformation."
26,"A VLBI survey of compact broad absorption line quasars with balnicity
  index BI>0",http://arxiv.org/abs/1507.00998v1,"We performed high resolution radio observations of a new sample of ten BAL
quasars using both the VLBA and EVN at 5 GHz. All the selected sources have
balnicity indices (BI) more than 0 and radio flux densities less than 80 mJy at
1.4 GHz. They are very compact with linear sizes of the order of a few tens of
parsecs and radio luminosities at 1.4 GHz above the FRI-FRII luminosity
threshold. Most of the observed objects have been resolved at 5 GHz showing
one-sided, probably core-jet structures, typical for quasars. We discuss in
detail their age and orientation based on the radio observations. We then used
the largest available sample of BAL quasars to study the relationships between
the radio and optical properties in these objects. We found that (1) the
strongest absorption (high values of the balnicity index BI) is connected with
the lower values of the radio-loudness parameter, logR_I<1.5, and thus probably
with large viewing angles; (2) the large span of the BI values in each bin of
the radio-loudness parameter indicates that the orientation is only one of the
factors influencing the measured absorption; (3) most of the radio-loud BAL
quasars are compact, low luminosity objects with a wide range of jet power
(although the highest values of BI seem to be associated with the lower values
of jet power). In addition, we suggest that the short lifetime postulated for
some compact AGNs could also explain the scarcity of the large-scale radio
sources among BAL quasars."
27,"Importance of spin-orbit coupling in power factor calculations for
  half-Heusler ANiB (A=Ti, Hf, Sc, Y; B=Sn, Sb, Bi)",http://arxiv.org/abs/1512.07710v1,"We investigate the spin-orbit coupling (SOC) effects on the electronic
structures and semi-classic transport coefficients of half-Heusler
$\mathrm{ANiB}$ (A=Ti, Hf, Sc, Y; B=Sn, Sb, Bi) by using generalized gradient
approximation (GGA). Calculated results show that SOC splits the valence bands
at high symmetry $\Gamma$ point, and modifies the outline of $\Gamma$-centered
valence bands, which has remarkable effects on the electron transport
properties. Thermoelectric properties are performed through solving Boltzmann
transport equations within the constant scattering time approximation. It is
found that the compounds containing Sn atom have larger power factor in p-type
doping than ones in n-type doping, and it is just the opposite for compounds
containing Sb and Bi elements. The SOC has obvious detrimental influence on
power factor in p-type doping, while has a negligible effect in n-type doping.
These can be understood by considering the effects of SOC on the valence bands
and conduction bands. The maximum power factors (MPF) are extracted in n-type
and p-type doping with GGA and GGA+SOC, and the MPF at 300 K with SOC is
predicted to be about 4.25\%$\sim$44.13\% smaller than that without SOC in the
case of p-type doping for $\mathrm{ANiB}$ (A=Ti, Hf, Sc, Y; B=Sn, Sb, Bi).
Therefore, it is crucial to consider SOC effects for theoretical analysis in
the case of p-type doping in half-Heusler compounds composed of heavy elements."
28,"Least Upper Bounds of the Powers Extracted and Scattered by
  Bi-anisotropic Particles",http://arxiv.org/abs/1402.4726v1,"The least upper bounds of the powers extracted and scattered by
bi-anisotropic particles are investigated analytically. A rigorous derivation
for particles having invertible polarizability tensors is presented, and the
particles with singular polarizability tensors that have been reported in the
literature are treated explicitly. The analysis concludes that previous upper
bounds presented for isotropic particles can be extrapolated to bi-anisotropic
particles. In particular, it is shown that neither nonreciprocal nor
magnetoelectric coupling phenomena can further increase those upper bounds on
the extracted and scattered powers. The outcomes are illustrated further with
approximate circuit model examples of two dipole antennas connected via a
generic lossless network."
29,"A Sunyaev-Zel'dovich take on cluster radio haloes -- I. Global scaling
  and bi-modality using Planck data",http://arxiv.org/abs/1111.2856v3,"Giant radio haloes in galaxy clusters are the primary evidence for the
existence of relativistic particles (cosmic rays) and magnetic fields over Mpc
scales. Observational tests for the different theoretical models explaining
their powering mechanism have so far been obtained through X-ray selection of
clusters, e.g. by comparing cluster X-ray luminosities with radio halo power.
Here we present the first global scaling relations between radio halo power and
integrated Sunyaev-Zel'dovich (SZ) effect measurements, using the Planck
all-sky cluster catalog and published radio data. The correlation agrees well
with previous scaling measurements based on X-ray data, and offers a more
direct probe into the mass dependence inside radio haloes. However, we find no
strong indication for a bi-modal cluster population split between radio halo
and radio quiet objects. We discuss the possible causes for this apparent lack
of bi-modality, and compare the observed slope of the radio-SZ correlation with
competing theoretical models of radio halo origin."
30,"Spin-orbit coupling and weak antilocalization in thermoelectric material
  $β$-K$_{2}$Bi$_{8}$Se$_{13}$",http://arxiv.org/abs/1312.6091v1,"We have studied the effect of spin-orbital coupling (SOC) on electronic
transport properties of the thermoelectric material
$\beta$-K$_{2}$Bi$_{8}$Se$_{13}$ via magnetoresistance (MR) measurements. We
found that the strong SOC in this material results in weak antilocalization
(WAL) effect, which can be well described by the three-dimensional weak
localization model. The phase coherence length extracted from theoretical
fitting exhibits a power-law temperature dependence with an exponent around
2.1, indicating that the electron phase dephasing is governed by electron -
transverse phonon interactions. Like in topological insulators, the WAL effect
in $\beta$-K$_{2}$Bi$_{8}$Se$_{13}$ can be quenched by magnetic impurities (Mn)
but is robust against non-magnetic impurities (Te). Although our
magnetotransport studies do not provide any evidences for topological surface
states, our analyses suggest that SOC plays an important role in determining
thermoelectric properties of $\beta$-K$_{2}$Bi$_{8}$Se$_{13}$."
31,"Bi-Objective Nonnegative Matrix Factorization: Linear Versus
  Kernel-Based Models",http://arxiv.org/abs/1501.05684v1,"Nonnegative matrix factorization (NMF) is a powerful class of feature
extraction techniques that has been successfully applied in many fields, namely
in signal and image processing. Current NMF techniques have been limited to a
single-objective problem in either its linear or nonlinear kernel-based
formulation. In this paper, we propose to revisit the NMF as a multi-objective
problem, in particular a bi-objective one, where the objective functions
defined in both input and feature spaces are taken into account. By taking the
advantage of the sum-weighted method from the literature of multi-objective
optimization, the proposed bi-objective NMF determines a set of nondominated,
Pareto optimal, solutions instead of a single optimal decomposition. Moreover,
the corresponding Pareto front is studied and approximated. Experimental
results on unmixing real hyperspectral images confirm the efficiency of the
proposed bi-objective NMF compared with the state-of-the-art methods."
32,"Surface roughness analysis of the hydrophilic SiO_2/TiO_2 nano bi-layers
  by Level crossing approach",http://arxiv.org/abs/1308.4444v1,"The effect of etching time on the statistical properties of the hydrophilic
surface of SiO_2/TiO_2/Glass nano bi-layer has been studied using Atomic Force
Microscopy (AFM) and stochastic approach based on the level crossing analysis.
We have created a rough surface of the hydrophilic SiO_2/TiO_2 nano bi-layer
system by using 26% Potassium Hydroxide (KOH) solution. Measuring the average
apparent contact angle assessed the degree of hydrophilicity and the optimum
condition was determined at 10 min etching time. Level crossing analysis based
on AF images provided deeper insight into the microscopic details of the
surface topography. For different etching time, it has been shown that the
average frequency of visiting a height with positive slope behaves Gaussian for
heights near the mean value and obeys power law for the heights far away from
the mean value. Finally, by applying the generalized total number of crossings
with positive slope, it was found that the both high heights and deep valleys
of the surface are extremely effective in hydrophilic degree of the
SiO_2/TiO_2/Glass nano bi-layer investigated system."
33,"Groove-rolling as an alternative process to fabricate Bi-2212 wires for
  practical applications",http://arxiv.org/abs/1403.4478v1,"Bi2Sr2CaCu2O8+x (Bi-2212) superconducting long-length wires are mainly
limited in obtaining high critical currents densities (JC) by the internal gas
pressure generated during the heat treatment, which expands the wire diameter
and dedensifies the superconducting filaments. Several ways have been developed
to increase the density of the superconducting filaments and therefore
decreasing the bubble density: much higher critical currents have been reached
always acting on the final as-drawn wires. We here try to pursue the same goal
of having a denser wire by acting on the deformation technique, through a
partial use of the groove-rolling at different wire processing stages. Such
technique has a larger powders compaction power, is straightforwardly adaptable
to long length samples, and allows the fabrication of samples with round,
square or rectangular shape depending on the application requirements. In this
paper we demonstrate the capability of this technique to increase the density
in Bi-2212 wires which leads to a three-fold increase in Jc with respect to
drawn wires, making this approach very promising for fabricating Bi-2212 wires
for high magnetic field magnets, i.e. above 25 T."
34,"Development of Ferromagnetic Fluctuations in Heavily Overdoped
  (Bi,Pb)_2_Sr_2_CuO_6+delta_ Copper Oxides",http://arxiv.org/abs/1808.02317v1,"We demonstrate the presence of ferromagnetic (FM) fluctuations in the
superconducting and non-superconducting heavily overdoped regimes of
high-temperature superconducting copper oxides, using
(Bi,Pb)_2_Sr_2_CuO_6+delta_ (Bi-2201) single crystals. Magnetization curves
exhibit a tendency to be saturated in high magnetic fields at low temperatures
in the heavily overdoped crystals, which is probably a precursor phenomenon of
a FM transition at a lower temperature. Muon spin relaxation detects the
enhancement of spin fluctuations at high temperatures below 200 K.
Correspondingly, the ab-plane resistivity follows a 4/3 power law in a wide
temperature range, which is characteristic of metals with two-dimensional FM
fluctuations due to itinerant electrons. As the Wilson ratio evidences the
enhancement of spin fluctuations with hole doping in the heavily overdoped
regime, it is concluded that two-dimensional FM fluctuations reside in the
heavily overdoped Bi-2201 cuprates, which is probably related to the decrease
in the superconducting transition temperature in the heavily overdoped
cuprates."
35,"Bi-Directional Mission Offloading for Agile Space-Air-Ground Integrated
  Networks",http://arxiv.org/abs/1902.03774v1,"Space-air-ground integrated networks (SAGIN) provide great strengths in
extending the capability of ground wireless networks. On the other hand, with
rich spectrum and computing resources, the ground networks can also assist
space-air networks to accomplish resource-intensive or power-hungry missions,
enhancing the capability and sustainability of the space-air networks.
Therefore, bi-directional mission offloading can make full use of the
advantages of SAGIN and benefits both space-air and ground networks. In this
article, we identify the key role of network reconfiguration in coordinating
heterogeneous resources in SAGIN, and study how network function virtualization
(NFV) and service function chaining (SFC) enable agile mission offloading. A
case study validates the performance gain brought by bi-directional mission
offloading. Future research issues are outlooked as the bi-directional mission
offloading framework opens a new trail in releasing the full potentials of
SAGIN."
36,"Ultra linear magnetic flux-to-voltage conversion in superconducting
  quantum interference proximity transistors",http://arxiv.org/abs/2207.00339v1,"Superconducting interferometers are quantum devices able to transduce a
magnetic flux into an electrical output with excellent sensitivity,
integrability and power consumption. Yet, their voltage response is
intrinsically non-linear, a limitation which is conventionally circumvented
through the introduction of compensation inductances or by the construction of
complex device arrays. Here we propose an intrinsically-linear flux-to-voltage
mesoscopic transducer, called bi-SQUIPT, based on the superconducting quantum
interference proximity transistor as fundamental building block. The bi-SQUIPT
provides a voltage-noise spectral density as low as $\sim10^{-16}$ V/Hz$^{1/2}$
and, more interestingly, under a proper operation parameter selection, exhibits
a spur-free dynamic range as large as $\sim60$ dB, a value on par with that
obtained with state-of-the-art SQUID-based linear flux-to-voltage
superconducting transducers. Furthermore, thanks to its peculiar measurement
configuration, the bi-SQUIPT is tolerant to imperfections and non-idealities in
general. For the above reasons, we believe that the bi-SQUIPT could provide a
relevant step-beyond in the field of low-dissipation and low-noise current
amplification with a special emphasis on applications in cryogenic quantum
electronics."
37,"Power-Aware Virtual Network Function Placement and Routing using an
  Abstraction Technique",http://arxiv.org/abs/1807.07876v2,"The Network Function Virtualization (NFV) is very promising for efficient
provisioning of network services and is attracting a lot of attention. NFV can
be implemented in commercial off-the-shelf servers or Physical Machines (PMs),
and many network services can be offered as a sequence of Virtual Network
Functions (VNFs), known as VNF chains. Furthermore, many existing network
devices (e.g., switches) and collocated PMs are underutilized or
over-provisioned, resulting in low power-efficiency. In order to achieve more
energy efficient systems, this work aims at designing the placement of VNFs
such that the total power consumption in network nodes and PMs is minimized,
while meeting the delay and capacity requirements of the foreseen demands.
Based on existing switch and PM power models, we propose a Integer Linear
Programming (ILP) formulation to find the optimal solution. We also propose a
heuristic based on the concept of Blocking Islands (BI), and a baseline
heuristic based on the Betweenness Centrality (BC) property of the graph. Both
heuristics and the ILP solutions have been compared in terms of total power
consumption, delay, demands acceptance rate, and computation time. Our
simulation results suggest that BI-based heuristic is superior compared with
the BC-based heuristic, and very close to the optimal solution obtained from
the ILP in terms of total power consumption and demands acceptance rate.
Compared to the ILP, the proposed BI-based heuristic is significantly faster
and results in 22% lower end-to-end delay, with a penalty of consuming 6% more
power in average."
38,"Classification of COVID-19 anomalous diffusion driven by mean squared
  displacement",http://arxiv.org/abs/2107.13517v1,"In this study, we classify the COVID-19 anomalous diffusion in two categories
of countries based on the mean squared displacement (MSD) of daily new cases,
which includes the top four countries and four randomly selected countries in
terms of the total cases. The COVID-19 diffusion is a stochastic process, and
the daily new cases are regarded as the displacements of diffusive particles.
The diffusion environment of COVID-19 in each country is heterogeneous, in
which the underlying dynamic process is anomalous diffusion. The calculated MSD
is a power law function of time, and the power law exponent is not a constant
but varies with time. The power law exponents are estimated by using the
bi-exponential model and the long short-term memory network (LSTM). The
bi-exponential model frequently use in magnetic resonance imaging (MRI) can
quantify the power law exponent and make an easy prediction. The LSTM network
has much better accuracy than the bi-exponential model in predicting the power
law exponent. The LSTM network is more flexible and preferred to predict the
power law exponent, which is independent on the unique mathematical formula.
The diffusion process of COVID-19 can be classified based on the power law
exponent. More specific evaluation and suggestion can be proposed and submitted
to the government in order to control the COVID-19 diffusion."
39,"Thermoelectric calculations of ring-shaped bands in two-dimensional
  Bi$_2$Te$_3$, Bi$_2$Se$_3$ and Sb$_2$Te$_3$: a comparison of simple
  scattering approximations",http://arxiv.org/abs/2008.06807v1,"Materials with ring-shaped electronic bands are promising thermoelectric
candidates, since their unusual dispersion shape is predicted to give large
power factors. While previous calculations of these materials have relied on
the assumption of a constant mean-free-path or relaxation time, recent
first-principles modeling of electron-phonon scattering suggests that the
scattering rates may be better approximated by the electron density-of-states
(so-called DOS scattering model). In this work, we use density functional
theory to investigate single and double quintuple-layer Bi$_2$Te$_3$,
Bi$_2$Se$_3$ and Sb$_2$Te$_3$, with a focus on understanding how the three
aforementioned scattering approximations impact thermoelectric performance --
emphasis is placed on the DOS scattering model. The single quintuple-layer
materials possess two ring-shaped valence band maxima that provide an abrupt
increase in conducting channels, which benefits the power factor. Additionally,
below the band edge a ring-shaped minimum, located between the two maxima, is
found to further enhance the thermoelectric performance but only with the DOS
scattering model. This comes from a sharp drop in the DOS, and thus scattering,
just below the ring-shaped minimum. An analytic octic dispersion model is
introduced and shown to qualitatively capture the observed features. The double
quintuple-layer materials display notably worse thermoelectric properties,
since their dispersions are significantly modified compared to the single
quintuple-layer case. The benefits of ring-shaped bands are sensitive to the
alignment of the two ring maxima and to the degree of ring anisotropy. Overall,
single quintuple-layer Bi$_2$Te$_3$ and Bi$_2$Se$_3$ are most promising, with
the DOS scattering model giving the highest power factors."
