Index,Title,URL,Summary
1,"The Hadamard Products for bi-periodic Fibonacci and bi-periodic Lucas
  Generating matrices",http://arxiv.org/abs/1705.05127v1,"In this paper, firstly, we define the Qq-generating matrix for bi-periodic
Fibonacci polynomial. And we give nth power, determinant and some properties of
the bi-periodic Fibonacci polynomial by considering this matrix representation.
Also, we introduce the Hadamard products for bi-periodic Fibonacci Qnq
generating matrix and bi-periodic Lucas Qnl generating matrix of which entries
is bi-periodic Fibonacci and Lucas numbers. Then, we investigate some
properties of these products."
2,"Auto-BI: Automatically Build BI-Models Leveraging Local Join Prediction
  and Global Schema Graph",http://arxiv.org/abs/2306.12515v1,"Business Intelligence (BI) is crucial in modern enterprises and
billion-dollar business. Traditionally, technical experts like database
administrators would manually prepare BI-models (e.g., in star or snowflake
schemas) that join tables in data warehouses, before less-technical business
users can run analytics using end-user dashboarding tools. However, the
popularity of self-service BI (e.g., Tableau and Power-BI) in recent years
creates a strong demand for less technical end-users to build BI-models
themselves.
  We develop an Auto-BI system that can accurately predict BI models given a
set of input tables, using a principled graph-based optimization problem we
propose called \textit{k-Min-Cost-Arborescence} (k-MCA), which holistically
considers both local join prediction and global schema-graph structures,
leveraging a graph-theoretical structure called \textit{arborescence}. While we
prove k-MCA is intractable and inapproximate in general, we develop novel
algorithms that can solve k-MCA optimally, which is shown to be efficient in
practice with sub-second latency and can scale to the largest BI-models we
encounter (with close to 100 tables).
  Auto-BI is rigorously evaluated on a unique dataset with over 100K real BI
models we harvested, as well as on 4 popular TPC benchmarks. It is shown to be
both efficient and accurate, achieving over 0.9 F1-score on both real and
synthetic benchmarks."
3,"Thermoelectric power of Bi and Bi(1-x)Te(x), x=0.0014,in porous Vycor
  glass",http://arxiv.org/abs/cond-mat/0311112v1,"Semiconductor quantum wires constitute a promising thermoelectric material
because of the increase of the electronic density of states in low-dimensional
materials. We studied the magnetic-field-dependent resistance and Seebeck
coefficient of a high-density network of 6-nm-diameter wires of Bi and of
Bi(1-x)Te(x), x=0.0014, in porous Vycor glass. The resistance R increases as
temperature decreases from 300 K down to 0.3 K for both composites. However, in
contrast to recent results that demonstrate the semiconducting behavior of the
resistance and very large enhancements of the thermoelectric power of
composites containing Bi nanowires with diameters of 9 and 15 nm, we find that
the resistance is not thermally activated and that the thermoelectric power of
the composites is of the same order of magnitude as the thermoelectric power of
bulk Bi. Our results are consistent with the nanowires having carrier density
that is enhanced by surface effects."
4,"Thermoelectric power factor of Bi-Sb-Te and Bi-Te-Se alloys and doping
  strategy: First-principles study",http://arxiv.org/abs/1704.01723v1,"By performing first principles calculations combined with Boltzmann transport
equations, we calculate the thermoelectric power factor (PF) of Bi-Sb-Te and
Bi-Te-Se ternary alloys as a function of alloy composition ratio, carrier
concentration, and temperature. The point defect formation energy calculations
also perform to search potential n-type dopant candidates in ternaries."
5,"Effect of Bi-substitution on Structural Stability and Improved
  Thermoelectric Performance of p-type Half-Heusler TaSbRu: A First-principles
  Study",http://arxiv.org/abs/2008.12564v1,"Recently, Fang et al. have predicted a high ZT of 1.54 in TaSbRu alloys at
1200 K from first-principles without considering spin-orbit interaction,
accurate electronic structure, details of phonon scattering, and
energy-dependent holes relaxation time. Here, we report the details of
structural stability and thermoelectric performance of Bi-Substituted p-type
TaSbRu from first-principles calculations considering theses important
parameters. This indirect bandgap semiconductor (Eg=0.8 eV by TB-mBJ+SOC) has
highly dispersive and degenerate valence bands, which lead to a maximum power
factor, 3.8 mWm-1K-2 at 300K. As Sb-5p has a small contribution to the bandgap
formation, the substitution of Bi on the Sb site does not cause significant
change to the electronic structure. Although the Seebeck coefficient increases
by Bi due to slight changes in the bandgap, electrical conductivity, and hence,
the power factor reduces to ~3 mW m-1K-2 at 300K (50% Bi). On the other side,
lattice thermal conductivity drops effectively to 5 from 20 W/m K as Bi
introduces a significant contribution in the acoustic phonon region and
intensify phonon scattering. Thus, ZT value is improved through
Bi-substitution, reaching 1.1 (50% Bi) at 1200 K from 0.45 (pure TaSbRu) only.
Therefore, the present study suggests how to improve the TE performance of
Sb-based half-Heusler compounds and TaSbRu (with 50% Bi) is a promising
material for high-temperature applications."
6,"Rotatory power reversal induced by magnetic-current in bi-isotropic
  media",http://arxiv.org/abs/2207.03888v1,"Bi-isotropic media constitute a proper scenario for scrutinizing optical
effects stemming from magnetoelectric parameters. Chiral magnetic current is a
macroscopic effect arising from the chiral magnetic effect that enriches the
phenomenology of a classical dielectric medium. This work examines optical
aspects of bi-isotropic media in the presence of magnetic conductivity. The
full isotropic scenario manifests circular birefringence described by a
dispersive rotatory power that changes sign at a given frequency. For a
bi-isotropic medium with antisymmetric magnetic conductivity, an intricate
dispersive rotatory power is attained, supplied with sign reversal as well.
This scenario also indicates a handedness reversion of the medium, an unusual
property in dielectrics, which may work as a signature of bi-isotropic media
supporting chiral magnetic current."
7,"Navigating the acceptance of implementing business intelligence in
  organizations: A system dynamics approach",http://arxiv.org/abs/2308.10244v1,"The rise of information technology has transformed the business landscape,
with organizations increasingly relying on information systems to collect and
store vast amounts of data. To stay competitive, businesses must harness this
data to make informed decisions that optimize their actions in response to the
market. Business intelligence (BI) is an approach that enables organizations to
leverage data-driven insights for better decision-making, but implementing BI
comes with its own set of challenges. Accordingly, understanding the key
factors that contribute to successful implementation is crucial.
  This study examines the factors affecting the implementation of BI projects
by analyzing the interactions between these factors using system dynamics
modeling. The research draws on interviews with five BI experts and a review of
the background literature to identify effective implementation strategies.
Specifically, the study compares traditional and self-service implementation
approaches and simulates their respective impacts on organizational acceptance
of BI. The results show that the two approaches were equally effective in
generating organizational acceptance until the twenty-fifth month of
implementation, after which the self-service strategy generated significantly
higher levels of acceptance than the traditional strategy. In fact, after 60
months, the self-service approach was associated with a 30% increase in
organizational acceptance over the traditional approach. The paper also
provides recommendations for increasing the acceptance of BI in both
implementation strategies. Overall, this study underscores the importance of
identifying and addressing key factors that impact BI implementation success,
offering practical guidance to organizations seeking to leverage the power of
BI in today's competitive business environment."
8,"Fano resonance in two-dimensional optical waveguide arrays with a
  bi-modal defect",http://arxiv.org/abs/nlin/0508016v1,"We study the two-dimensional extension of the Fano-Anderson model on the
basis of a two-dimensional optical waveguide array with a bi-modal defect. We
demonstrate numerically the persistence of the Fano resonance in wavepacket
scattering process by the defect. An analytical approximation is derived for
the total scattered light power."
9,"Strategy for enhanced thermoelectric performance of Bi2S3 nanorods by Bi
  nanoinclusions",http://arxiv.org/abs/1906.03003v1,"This is the first report on the enhanced thermoelectric (TE) properties of
novel Bi2S3-Bi nanocomposites synthesized using a one-step polyol method at
different reaction temperatures (TRe) and time. They are well-characterized as
nanorod-composites, coexistent with orthorhombic Bi2S3 and rhombohedral Bi
phases together in which the latter coats the former forming Bi2S3-Bi
core-shell type structures along with independent Bi nanoparticles (NPs). There
is a very significant observation of systematic reduction in electri-cal
resistivity \r{ho} with reaction temperature and time duration increase,
revealing a promising approach for reduction of \r{ho} in this highly resistive
Bi2S3 and hence resolving the earlier obstacles for its thermoelectric
application potentials for the past few decades. Most astonishingly, TE power
factor at 300 K of highest Bi content nanocomposite pellet, made at 27 oC using
~900 MPa pressure, is 3 orders of magnitude greater than that of hot-pressed
Bi2S3, or even 23% better than that of spark plasma-sintered core-shell
Bi2S3@Bi sample reported earlier (Tarachand et al. Nano Res. 2016, 9, 3291; Ge
et al. ACS Appl. Mater. Interfaces 2017, 9, 4828). Considering the probable
greatly reduced thermal conductivity due to their complex nanostructures, the
significantly improved TE performance potential near 300 K is highly
anticipated for these toxic- and rare earth element-free TE nanocomposites,
making the present synthesis method as a pioneering approach for developing
enhanced thermoelectric properties of Bi2S3-based materials without using extra
sintering steps."
10,"Resonant-state expansion for open optical systems: Generalization to
  magnetic, chiral, and bi-anisotropic materials",http://arxiv.org/abs/1801.08883v1,"The resonant-state expansion, a recently developed powerful method in
electrodynamics, is generalized here for open optical systems containing
magnetic, chiral, or bi-anisotropic materials. It is shown that the key matrix
eigenvalue equation of the method remains the same, but the matrix elements of
the perturbation now contain variations of the permittivity, permeability, and
bi-anisotropy tensors. A general normalization of resonant states in terms of
the electric and magnetic fields is presented."
11,"Bipartite bi-Cayley graphs over metacyclic groups of odd prime-power
  order",http://arxiv.org/abs/1707.02790v1,"A graph $\Gamma$ is a bi-Cayley graph over a group $G$ if $G$ is a
semiregular group of automorphisms of $\Gamma$ having two orbits. Let $G$ be a
non-abelian metacyclic $p$-group for an odd prime $p$, and let $\Gamma$ be a
connected bipartite bi-Cayley graph over the group $G$. In this paper, we prove
that $G$ is normal in the full automorphism group ${\rm Aut}(\Gamma)$ of
$\Gamma$ when $G$ is a Sylow $p$-subgroup of ${\rm Aut}(\Gamma)$. As an
application, we classify half-arc-transitive bipartite bi-Cayley graphs over
the group $G$ of valency less than $2p$. Furthermore, it is shown that there
are no semisymmetric and no arc-transitive bipartite bi-Cayley graphs over the
group $G$ of valency less than $p$."
12,"Bismuth-doped Ga2O3 as candidate for p-type transparent conducting
  material",http://arxiv.org/abs/1906.00840v1,"Gallium oxide (Ga2O3) is a wide-band-gap semiconductor promising for UV
sensors and high power transistor applications, with Baliga's figure of merit
that far exceeds those of GaN and SiC, second only to diamond. Engineering its
band structure through alloying will broaden its range of applications. Using
hybrid density functional calculations we study the effects on adding Bi to
Ga2O3. While in III-V semiconductors, such as GaAs and InAs, Bi tend to
substitute on the pnictide site, we find that in Ga2O3, Bi prefers to
substitute on the Ga site, resulting in dilute (Ga_{1-x}Bi_{x})2O3 alloys with
unique electronic structure properties. Adding a few percent of Bi reduces the
band gap of Ga2O3 by introducing an intermediate valence band that is
significantly higher in energy than the valence band of the host material. This
intermediate valence band is composed mainly of Bi 6s and O 2p orbitals, and it
is sufficiently high in energy to provide opportunity for p-type doping."
13,"Devices for Thermal Conductivity Measurements of Electroplated Bi for
  X-ray TES Absorbers",http://arxiv.org/abs/2111.02503v1,"Electroplated Bismuth (Bi) is commonly used in Transition-Edge Sensors (TESs)
for X-rays because of its high stopping power and low heat capacity.
Electroplated Bi is usually grown on top of another metal that acts as seed
layer, typically gold (Au), making it challenging to extrapolate its
thermoelectric properties. In this work, we present four-wire resistance
measurement structures that allow us to measure resistance as a function of
temperature of electroplated Bi independently of Au. The results show that the
thermal conductivity of the Bi at 3 K is high enough to guarantee the correct
thermalization of X-ray photons when used as an absorber for TESs."
14,"Microstructure analysis of bismuth absorbers for transition-edge sensor
  X-ray microcalorimeters",http://arxiv.org/abs/1711.02215v1,"Transition-edge sensors (TESs) as microcalorimeters offer high resolving
power, owning to their sharp response and low operating temperature. In the
hard X-ray regime and above, the demand for high quantum-efficiency requires
the use of absorbers. Bismuth (Bi), owing to its low heat carrier density and
high X-ray stopping power, has been widely used as an absorber material for
TESs. However, distinct spectral responses have been observed for Bi absorbers
deposited via evaporation versus electroplating. Evaporated Bi absorbers are
widely observed to have a non-Gaussian tail on the low energy side of measured
spectra. In this study, we fabricated Bi absorbers via these two methods, and
performed microstructure analysis using scanning electron microscopy (SEM) and
X-ray diffraction microscopy. The two types of material showed the same
crystallographic structure, but the grain size of the evaporated Bi was about
40 times smaller than that of the electroplated Bi. This distinction in grain
size is likely to be the cause of their different spectral responses."
15,"Reinforcement Learning-Based Cooperative P2P Power Trading between DC
  Nanogrid Clusters with Wind and PV Energy Resources",http://arxiv.org/abs/2209.07744v2,"In replacing fossil fuels with renewable energy resources for carbon
neutrality, the unbalanced resource production of intermittent wind and
photovoltaic (PV) power is a critical issue for peer-to-peer (P2P) power
trading. To address this issue, a reinforcement learning (RL) technique is
introduced in this paper. For RL, a graph convolutional network (GCN) and a
bi-directional long short-term memory (Bi-LSTM) network are jointly applied to
P2P power trading between nanogrid clusters, based on cooperative game theory.
The flexible and reliable DC nanogrid is suitable for integrating renewable
energy for a distribution system. Each local nanogrid cluster takes the
position of prosumer, focusing on power production and consumption
simultaneously. For the power management of nanogrid cluster, multi-objective
optimization is applied to each local nanogrid cluster with the Internet of
Things (IoT) technology. Charging/discharging of an electric vehicle (EV) is
executed considering the intermittent characteristics of wind and PV power
production. RL algorithms, such as GCN- convolutional neural network (CNN)
layers for deep Q-learning network (DQN), GCN-LSTM layers for deep recurrent
Q-learning network (DRQN), GCN-Bi-LSTM layers for DRQN, and GCN-Bi-LSTM layers
for proximal policy optimization (PPO), are used for simulations. Consequently,
the cooperative P2P power trading system maximizes the profit by considering
the time of use (ToU) tariff-based electricity cost and the system marginal
price (SMP), and minimizes the amount of grid power consumption. Power
management of nanogrid clusters with P2P power trading is simulated on a
distribution test feeder in real time, and the proposed GCN-Bi-LSTM-PPO
technique achieving the lowest electricity cost among the RL algorithms used
for comparison reduces the electricity cost by 36.7%, averaging over nanogrid
clusters."
16,"Investigating Phase Transition and Morphology of Bi-Te Thermoelectric
  System",http://arxiv.org/abs/1909.08613v2,"The optimization of secondary phase in thermoelectric(TE) materials can
{helps in improvisation of material's efficiency}. Being a potential
{contender} for lower temperature TE application, bismuth
telluride(Bi$_2$Te$_3$) nanoparticles were synthesized via different routes and
profiles to optimize their pure single phase. Systematic characterizations were
performed with the help of X-ray diffraction (XRD), Rietveld refinement and
field effect-scanning electron microscopy(FE-SEM) for structural and
morphological behavior, while TE properties such as Seebeck coefficient,
electrical conductivity and power-factor were measured for the purest sample
chosen. Rietveld refinement in the XRD pattern of the samples revealed that
only a small amount ($\sim$ 1.6\%) of Bi$_2$Te$_3$ was formed in
co-precipitation method, while the hydrothermal technique increases this phase
with increment in synthesis duration. This work focused on the phase evolution
of Bi$_2$Te$_3$ with increasing synthesis duration time at constant temperature
and vice-versa. XRD and Rietveld refinement revealed that the hydrothermal
technique (150 $^\circ$C for 48 hours) can synthesize purest samples (84\%
Bi$_2$Te$_3$ phase in this case). {FE-SEM and Energy Dispersive X-ray analysis
unveiled that the impure phases in the system {were} quantitatively reduced,
and it supported by decline in atomic percentage of oxygen from 37\% to 11\%,
in addition to this, it was also found that particle size was also decreased
with increase in temperature.} The observed electrical conductivity of the
chosen sample is $\sim$20 times greater, while Seebeck coefficient is $\sim$3
times lower than that of pure Bi$_2$Te$_3$ phase. The detailed analysis has
generalized the growth mechanism in Bi$_2$Te$_3$ phase evolution by the
diffusion of Bi into Te nanorods to fabricate hexagonal Bi$_2$Te$_3$."
17,"A Focusing Framework for Testing Bi-Directional Causal Effects with GWAS
  Summary Data",http://arxiv.org/abs/2203.06887v1,"Mendelian randomization (MR) is a powerful method that uses genetic variants
as instrumental variables (IVs) to infer the causal effect of a modifiable
exposure on an outcome. Although recent years have seen many extensions of
basic MR methods to be robust to certain violations of assumptions, few methods
were proposed to infer bi-directional causal relationships, especially for
phenotypes with limited biological understandings. The presence of horizontal
pleiotropy adds another layer of complexity. In this article, we show that
assumptions for common MR methods are often impossible or too stringent in the
existence of bi-directional relationships. We then propose a new focusing
framework for testing bi-directional causal effects between two traits with
possibly pleiotropic genetic variants. Our proposal can be coupled with many
state-of-art MR methods. We provide theoretical guarantees on the Type I error
and power of the proposed methods. We demonstrate the robustness of the
proposed methods using several simulated and real datasets."
18,"Real-Time Bi-directional Electric Vehicle Charging Control with
  Distribution Grid Implementation",http://arxiv.org/abs/1711.03086v1,"As electric vehicle (EV) adoption is growing year after year, there is no
doubt that EVs will occupy a significant portion of transporting vehicle in the
near future. Although EVs have benefits for environment, large amount of
un-coordinated EV charging will affect the power grid and degrade power
quality. To alleviate negative effects of EV charging load and turn them to
opportunities, a decentralized real-time control algorithm is developed in this
paper to provide optimal scheduling of EV bi-directional charging. To evaluate
the performance of the proposed algorithm, numerical simulation is performed
based on real-world EV user data, and power flow analysis is carried out to
show how the proposed algorithm improve power grid steady state operation. .
The results show that the implementation of proposed algorithm can effectively
coordinate bi-directional charging by 30% peak load shaving, more than 2% of
voltage drop reduction, and 40% transmission line current decrease."
19,"Hamiltonicity of bi-power of bipartite graphs, for finite and infinite
  cases",http://arxiv.org/abs/1902.06403v1,"For a graph $G$, the $t$-th power $G^t$ is the graph on $V(G)$ such that two
vertices are adjacent if and only if they have distance at most $t$ in $G$; and
the $t$-th bi-power $G_B^t$ is the graph on $V(G)$ such that two vertices are
adjacent if and only if their distance in $G$ is odd at most $t$. Fleischner's
theorem states that the square of every 2-connected finite graph has a
Hamiltonian cycle. Georgakopoulos prove that the square of every 2-connected
infinite locally finite graph has a Hamiltonian circle. In this paper, we
consider the Hamiltonicity of the bi-power of bipartite graphs. We show that
for every connected finite bipartite graph $G$ with a perfect matching, $G_B^3$
has a Hamiltonian cycle. We also show that if $G$ is a connected infinite
locally finite bipartite graph with a perfect matching, then $G_B^3$ has a
Hamiltonian circle."
20,$V$-universal Hopf algebras (co)acting on $Ω$-algebras,http://arxiv.org/abs/2005.12954v4,"We develop a theory which unifies the universal (co)acting bi/Hopf algebras
as studied by Sweedler, Manin and Tambara with the recently introduced
\cite{AGV1} bi/Hopf-algebras that are universal among all support equivalent
(co)acting bi/Hopf algebras. Our approach uses vector spaces endowed with a
family of linear maps between tensor powers of $A$, called $\Omega$-algebras.
This allows us to treat algebras, coalgebras, braided vector spaces and many
other structures in a unified way. We study $V$-universal measuring coalgebras
and $V$-universal comeasuring algebras between $\Omega$-algebras $A$ and $B$,
relative to a fixed subspace $V$ of $\Vect(A,B)$. By considering the case
$A=B$, we derive the notion of a $V$-universal (co)acting bialgebra (and Hopf
algebra) for a given algebra $A$. In particular, this leads to a refinement of
the existence conditions for the Manin--Tambara universal coacting bi/Hopf
algebras. We establish an isomorphism between the $V$-universal acting bi/Hopf
algebra and the finite dual of the $V$-universal coacting bi/Hopf algebra under
certain conditions on $V$ in terms of the finite topology on $\End_F(A)$."
21,"Ultrafast multi-photon excitation of ScVO$_4$:Bi$^{3+}$ for luminescence
  thermometry",http://arxiv.org/abs/2112.00010v2,"We demonstrate a multi-photon excitation (MPE) scheme for luminescence
thermometry using ScVO$_4$:Bi$^{3+}$. MPE is performed using a 37 fs
Ti:Sapphire laser pulse centred at 800 nm. Log-log plots of the phosphorescence
intensity versus excitation power show that the 800 nm MPE of
ScVO$_4$:Bi$^{3+}$ involves a 2- and 3-photon absorption process in comparison
to a single-photon excitation (SPE) process at 266 nm and 400 nm. Spectroscopic
investigation shows that with the 800 nm MPE and 266 nm SPE schemes, the
emission spectra of ScVO$_4$:Bi$^{3+}$ are similarly characterized by emissions
of the VO$_4^{3-}$ groups and Bi$^{3+}$. The MPE is advantageous to suppress
fluorescence which interfere with the phosphorescence signal. We demonstrate
this aspect for a ScVO$_4$:Bi$^{3+}$ coating applied on an alumina substrate.
The luminescence lifetime is calibrated with temperature over 294-334 K; the
MPE scheme has an equally impressive temperature sensitivity (3.4-1.7% / K) and
precision (0.2-0.7K) compared to the SPE schemes. The MPE scheme can be applied
to a variety of phosphors and is valuable for precise temperature measurements
even in applications where isolating interfering background emissions is
challenging."
